{
  "deviceCode": "KIOSK-01",
  "producedAt": "2025-09-09T16:00:00Z",
  "events": [
    {
      "eventId": "018f1b3c-9c8a-7a1b-8d2c-4d5e6f708002",
      "eventKey": "KIOSK-01:1736200000000:2",
      "producedAt": "2025-09-09T16:00:00Z",
      "deviceCode": "KIOSK-01",
      "kind": "UNBIND",
      "payload": {
        "tagKind": "NFC_HF",
        "tagUid": "04A1B2C3D4E5F6",
        "objectType": "ITEM",
        "objectId": "018f1b3c-9c8a-7a1b-8d2c-4d5e6f7080c2"
      }
    }
  ],
  "batchId": "018f1b3c-9c8a-7a1b-8d2c-4d5e6f708200"
}
